Indikator,Tipe
"saya tidak pernah suka membagikan tujuan atau rencana yang saya inginkan kecuali apabila memang berkaitan dengan pekerjaan dan hal hal kecil lainya, apabila tujuan atau rencana yang akan saya capai itu besar, saya cenderung menyimpanya sendiri",I
Saya keep rencana saya sampai rencana tersebut mencapai tujuan lalu saya ceritakan part bagaimana saya bisa sampai di titik itu tetapi hanya kepada orang yang saya anggap 'dekat' dengan saya,I
"Untuk hal yang bersifat rencana atau tujuan ada kalanya saya harus keep dengan tidak menceritakannya ke orang lain , namun jika rencana itu hanya sekedar tujuan universitas dan lain sebagainya saya tidak merasa keberatan bila membagikan nya dengan orang lain. ",I
"Jika saya memiliki sebuah rencana untuk masa depan saya, saya akan menyimpannya sendiri tanpa menunjukkan ke siapapun, saya akan menunjukkan hasilnya saja. Saya menunjukkan kepada keluarga dan teman² terdekat saya.",I
Saya tidak suka membagikan sebuah tujuan/rencana kepada orang lain jika menurut saya tujuan/rencana tersebut tidak ada gunanya untuk orang lain kecuali diri saya sendiri,I
"hanya orang-orang tertentu, seperti pacar dan teman tapi tidak sering",I
Hanya orang terdekat saja yang saya membagikan rencana kedepannya kalau untuk di bagikan ke orang umum nanti akan menjadi bahan omongan jika rencana tersebut tidak di jalankan dan saya lebih banyak membagikan itu kepada diri sendiri dan jarang membagikan kepada orang lain ,I
"Orang tertentu sih mas, biasanya yang saya percaya aja, karena kalau semua orang tahu, potensi rencana untuk gagal bisa tinggi karena pasti ada aja yang ngga suka dan iri, dan saya pribadi lebih suka keep sendiri sih, takut bikin orang lain berharap tinggi juga, malah ngecewain nantinya, jadi mending saya sendiri yang kecewa, orang lain jangan ",I
Tidak suka membagikan rencana saya untuk orang lain.,I
"Aku hanya akan membagikan kepada beberapa orang tertentu saja, dan itu sepertinya tidak sering kulakukan",I
"hanya kepada orang orang tertentu dan yang terdekat saja, sering hanya jika ingin bercerita",I
"jika rencana saya bersifat umum maka akan membagikan ke publik namun dan jika rencana itu bersifat pribadi atau bisa dijadikan lahan keuntungan mungkin saya akan membagi kepada orang orang tertentu.

untuk sering atau tidak jawaban nya adalah tidak cukup 1x atau 3x",E
biasanya saya hanya memperlihatkannya di sosmed ke teman dekat,E
"kepada orang orang tertentu, mungkin hanya beberapa kali",I
Saya akan membagikan hal tersebut ke orang-orang tertentu saja dan pada momen tertentu saja,E
Lebih suka untuk menyimpannya sendirian karena tujuan/rencana memiliki proses yang hanya diketahui oleh diri sendiri,I
Aku tidak akan memberitahu siapapun jika itu mengandung masalah pribadi. Jika tentang masa depan aku akan mengonsultasikan dengan teman terdekat dan orang tua.,I
"saya akan membagikan nya kepada orang orang tertentu saja,mungkin kalau ingat sering bercerita ",I
"saya hanya membagikannya kepada keluarga saja, karena menurut saya, orang lain tidak perlu tahu tentang apa yang saya rencanakan.",I
jika saya memiliki tujuan/rencana saya lebih sering menceritakan kepada teman” atau orang” terdekat saja,E
"Ya saya akan membagikannya, tetapi jarang",E
"Saya hanya membaginya kepada orang orang tertentu, setiap kali saya terpikirkan rencana atau tujuan tersebut maka daya akan membagikan ke teman yang saya percaya atau dekat dengan saya.",I
Terkadang saya membagikan ke sosial media namun lebih sering kepada orang tertentu saja seperti sahabat dekat saya,E
saya bukan tipe orang yang suka membagikan tujuan atau rencana kepada orang lain terutama di media sosial,I
"hanya orang-orang tertentu saja, saya tidak sering membagikannya karena jarang keluar dari rumah ",I
"jika saya mempunyai tujuan/rencana saya suka membagikan hal tersebut kepada orang orang tertentu, seperti sahabat saya/saudara saya. dan saya membagikan setiap saya mempunyai tujuan/rencana untuk kedepannya karena saya sangat sangat butuh support dan saran orang orang tertentu",I
Membagikan hal tersebut kepada publik. Sangat sering,E
Hanya kepada orang tertentu ,I
"Menceritakan kepada orang-orang tertentu seperti orangtua, dan saudara. Sering kali saya bercrita dengan mereka dan meminta saran, motivasi pada mereka.",I
"lebih suka membagikan hal kepada orang tertentu, namun saya tidak begitu sering membagikan rencana saya kepada orang lain kecuali rencana kecil-kecilan",I
lebih ke berbagi ke orang tertentu yang dekat saja,I
tidak suka membagikan ke publik lebih suka untuk berdiam ,I